{
  "$schema": "../spec/schema/field-map.schema.json",
  "branding.logo.primary": "assets/logos/client-logo-placeholder.svg",
  "branding.name": "TRUE NORTH",
  "branding.tagline": "PRECISION WELLNESS. GUIDED BY SCIENCE.",
  "product.name": "TESAMORELIN",
  "product.strength": "10MG",
  "tracking.qr.destination": "https://example.com/coa/TN062224",
  "tracking.lotValue": "TN062224",
  "tracking.ubdValue": "06/2026"
}
